texto_original,texto_limpo,tokens,comentarios,likes,compartilhamentos,repostagens,total,data_hora,author_handle,author_displayName,image_ref
"President Biden extended temporary deportation protections for roughly 900,000 people from countries including Venezuela and Ukraine, a move to protect some immigrants ahead of President-elect Donald Trump’s inauguration",president biden extended temporary deportation protections roughly people countries including venezuela ukraine move protect immigrants ahead presidentelect donald trumps inauguration,"['president', 'biden', 'extended', 'temporary', 'deportation', 'protections', 'roughly', 'people', 'countries', 'including', 'venezuela', 'ukraine', 'move', 'protect', 'immigrants', 'ahead', 'presidentelect', 'donald', 'trumps', 'inauguration']",2,76,17,0,95,2025-01-10T20:25:50.551Z,wsj.com,The Wall Street Journal,False
"Saudi Arabia and other Arab states are jockeying for influence with Syria’s Islamist government, despite misgivings about the jihadist past of the country’s new leaders",saudi arabia arab states jockeying influence syrias islamist government despite misgivings jihadist past countrys new leaders,"['saudi', 'arabia', 'arab', 'states', 'jockeying', 'influence', 'syrias', 'islamist', 'government', 'despite', 'misgivings', 'jihadist', 'past', 'countrys', 'new', 'leaders']",0,7,0,0,7,2025-01-10T20:25:02.849Z,wsj.com,The Wall Street Journal,False
"You may live thousands of miles away, but the wildfires tearing across Los Angeles and other natural disasters stand to raise your home-insurance bill https://www.wsj.com/personal-finance/wildfires-and-other-disasters-push-up-home-insurance-rates-thousands-of-miles-away-f0a20085?mod=bluesky",may live thousands miles away wildfires tearing across los angeles natural disasters stand raise homeinsurance bill,"['may', 'live', 'thousands', 'miles', 'away', 'wildfires', 'tearing', 'across', 'los', 'angeles', 'natural', 'disasters', 'stand', 'raise', 'homeinsurance', 'bill']",3,25,13,5,46,2025-01-10T19:13:03.755Z,wsj.com,The Wall Street Journal,True
Images: Maxar Technologies,images maxar technologies,"['images', 'maxar', 'technologies']",0,9,1,0,10,2025-01-10T18:31:04.458Z,wsj.com,The Wall Street Journal,False
"The Supreme Court voiced skepticism of TikTok’s challenge to a federal law requiring the China-based social-media app to shut down or find new owners by Jan. 19. 

ByteDance has said it won’t—and can’t—sell its U.S. business.",supreme court voiced skepticism tiktoks challenge federal law requiring chinabased socialmedia app shut find new owners jan bytedance said wontand cantsell us business,"['supreme', 'court', 'voiced', 'skepticism', 'tiktoks', 'challenge', 'federal', 'law', 'requiring', 'chinabased', 'socialmedia', 'app', 'shut', 'find', 'new', 'owners', 'jan', 'bytedance', 'said', 'wontand', 'cantsell', 'us', 'business']",4,28,4,0,36,2025-01-10T18:04:49.763Z,wsj.com,The Wall Street Journal,False
"Republicans are trying to rough out the architecture of their “one big, beautiful bill” to cut taxes, reduce spending and boost border security",republicans trying rough architecture one big beautiful bill cut taxes reduce spending boost border security,"['republicans', 'trying', 'rough', 'architecture', 'one', 'big', 'beautiful', 'bill', 'cut', 'taxes', 'reduce', 'spending', 'boost', 'border', 'security']",5,11,6,2,24,2025-01-10T18:04:02.758Z,wsj.com,The Wall Street Journal,False
"People are tipping less at restaurants than they have in at least six years, driven by fatigue over rising prices and growing prompts for tips https://www.wsj.com/business/hospitality/restaurant-tip-fatigue-servers-covid-9e198567?mod=bluesky",people tipping less restaurants least six years driven fatigue rising prices growing prompts tips,"['people', 'tipping', 'less', 'restaurants', 'least', 'six', 'years', 'driven', 'fatigue', 'rising', 'prices', 'growing', 'prompts', 'tips']",17,39,11,7,74,2025-01-10T17:00:17.651Z,wsj.com,The Wall Street Journal,True
"Heard on the Street: America has a serious housing shortage, but not for the type of apartments that real-estate investors have been building",heard street america serious housing shortage type apartments realestate investors building,"['heard', 'street', 'america', 'serious', 'housing', 'shortage', 'type', 'apartments', 'realestate', 'investors', 'building']",9,34,13,1,57,2025-01-10T16:25:02.356Z,wsj.com,The Wall Street Journal,False
"Critical fire conditions looked set to continue Friday as flames raged across more than 35,000 acres in the Los Angeles area and 10 people were confirmed dead.

Read more: on.wsj.com/409sfk4",critical fire conditions looked set continue friday flames raged across acres los angeles area people confirmed dead read onwsjcomsfk,"['critical', 'fire', 'conditions', 'looked', 'set', 'continue', 'friday', 'flames', 'raged', 'across', 'acres', 'los', 'angeles', 'area', 'people', 'confirmed', 'dead', 'read', 'onwsjcomsfk']",1,16,6,1,24,2025-01-10T16:11:48.650Z,wsj.com,The Wall Street Journal,True
Satellite images showed the breadth of the devastation from the Los Angeles wildfires,satellite images showed breadth devastation los angeles wildfires,"['satellite', 'images', 'showed', 'breadth', 'devastation', 'los', 'angeles', 'wildfires']",8,44,19,0,71,2025-01-10T16:10:09.550Z,wsj.com,The Wall Street Journal,True
"Exclusive: Trump’s real-estate company is in talks to reclaim its former D.C. hotel, an early test of how he will handle potential conflicts of interest",exclusive trumps realestate company talks reclaim former dc hotel early test handle potential conflicts interest,"['exclusive', 'trumps', 'realestate', 'company', 'talks', 'reclaim', 'former', 'dc', 'hotel', 'early', 'test', 'handle', 'potential', 'conflicts', 'interest']",33,31,14,19,97,2025-01-10T15:46:51.956Z,wsj.com,The Wall Street Journal,False
"Donald Trump becomes the first president sentenced for a felony. The judge handed down a sentence of unconditional discharge, which carries no punishment. https://www.wsj.com/us-news/law/trump-sentencing-hush-money-new-york-9f9282bc?mod=bluesky",donald trump becomes first president sentenced felony judge handed sentence unconditional discharge carries punishment,"['donald', 'trump', 'becomes', 'first', 'president', 'sentenced', 'felony', 'judge', 'handed', 'sentence', 'unconditional', 'discharge', 'carries', 'punishment']",52,179,39,14,284,2025-01-10T15:31:27.556Z,wsj.com,The Wall Street Journal,True
"""I don’t think there’s much left."" Thousands of people displaced by Los Angeles fires this week face a daunting question: Where to call home for now. https://www.wsj.com/real-estate/i-dont-think-theres-much-left-l-a-fires-leave-thousands-looking-for-temporary-housing-8421e47d?mod=bluesky",dont think theres much left thousands people displaced los angeles fires week face daunting question call home,"['dont', 'think', 'theres', 'much', 'left', 'thousands', 'people', 'displaced', 'los', 'angeles', 'fires', 'week', 'face', 'daunting', 'question', 'call', 'home']",4,22,3,0,29,2025-01-10T15:25:02.558Z,wsj.com,The Wall Street Journal,True
"Private jets began shuttling CEOs to Mar-a-Lago soon after Election Day. Then corporate bosses started killing diversity programs, climate-change initiatives and other policies Trump hates.",private jets began shuttling ceos maralago soon election day corporate bosses started killing diversity programs climatechange initiatives policies trump hates,"['private', 'jets', 'began', 'shuttling', 'ceos', 'maralago', 'soon', 'election', 'day', 'corporate', 'bosses', 'started', 'killing', 'diversity', 'programs', 'climatechange', 'initiatives', 'policies', 'trump', 'hates']",18,53,33,3,107,2025-01-10T14:41:02.754Z,wsj.com,The Wall Street Journal,False
"Breaking: Hiring powered ahead last month with 256,000 jobs added. The unemployment rate slipped to 4.1%.",breaking hiring powered ahead last month jobs added unemployment rate slipped,"['breaking', 'hiring', 'powered', 'ahead', 'last', 'month', 'jobs', 'added', 'unemployment', 'rate', 'slipped']",2,37,12,3,54,2025-01-10T13:37:29.655Z,wsj.com,The Wall Street Journal,False
"Critical fire conditions looked set to continue Friday as flames raged across more than 35,000 acres in the Los Angeles area and 10 people were confirmed dead",critical fire conditions looked set continue friday flames raged across acres los angeles area people confirmed dead,"['critical', 'fire', 'conditions', 'looked', 'set', 'continue', 'friday', 'flames', 'raged', 'across', 'acres', 'los', 'angeles', 'area', 'people', 'confirmed', 'dead']",1,23,9,0,33,2025-01-10T13:31:26.248Z,wsj.com,The Wall Street Journal,False
"At Leon’s in Manhattan, the tangy, tomato-based brodetto di pesce leaves you craving more. Then comes a pasta tossed in the leftover broth. Here's how to make your own version at home.",leons manhattan tangy tomatobased brodetto di pesce leaves craving comes pasta tossed leftover broth heres make version home,"['leons', 'manhattan', 'tangy', 'tomatobased', 'brodetto', 'di', 'pesce', 'leaves', 'craving', 'comes', 'pasta', 'tossed', 'leftover', 'broth', 'heres', 'make', 'version', 'home']",0,28,4,0,32,2025-01-10T00:50:02.548Z,wsj.com,The Wall Street Journal,False
"New Jersey's signature drink? The Jack Rose, of course. At this 18th-century inn, the version on offer warrants a Garden State excursion. https://on.wsj.com/407hf6F",new jerseys signature drink jack rose course thcentury inn version offer warrants garden state excursion,"['new', 'jerseys', 'signature', 'drink', 'jack', 'rose', 'course', 'thcentury', 'inn', 'version', 'offer', 'warrants', 'garden', 'state', 'excursion']",1,15,1,0,17,2025-01-09T23:41:02.548Z,wsj.com,The Wall Street Journal,True
"BlackRock is pulling out of a U.N.-sponsored climate initiative, a U-turn for a company that was once a poster-child of the environmental, social and governance investing movement",blackrock pulling unsponsored climate initiative uturn company posterchild environmental social governance investing movement,"['blackrock', 'pulling', 'unsponsored', 'climate', 'initiative', 'uturn', 'company', 'posterchild', 'environmental', 'social', 'governance', 'investing', 'movement']",8,42,27,6,83,2025-01-09T23:23:03.549Z,wsj.com,The Wall Street Journal,False
Tammy Romo is retiring after more than three decades at Southwest Airlines as the carrier works on a turnaround after lagging behind some of its peers in recent years.,tammy romo retiring three decades southwest airlines carrier works turnaround lagging behind peers recent years,"['tammy', 'romo', 'retiring', 'three', 'decades', 'southwest', 'airlines', 'carrier', 'works', 'turnaround', 'lagging', 'behind', 'peers', 'recent', 'years']",1,13,2,0,16,2025-01-09T22:48:03.251Z,wsj.com,The Wall Street Journal,False
"Wildfires in California aren’t all wild anymore. They often burn in urban areas, creating a toxic soup of smoke, ash and noxious substances that can be dangerous, even deadly 
🔗 https://on.wsj.com/42a3Zke",wildfires california arent wild anymore often burn urban areas creating toxic soup smoke ash noxious substances dangerous even deadly,"['wildfires', 'california', 'arent', 'wild', 'anymore', 'often', 'burn', 'urban', 'areas', 'creating', 'toxic', 'soup', 'smoke', 'ash', 'noxious', 'substances', 'dangerous', 'even', 'deadly']",3,28,18,3,52,2025-01-09T22:19:02.854Z,wsj.com,The Wall Street Journal,True
"Elon Musk’s artificial-intelligence startup, xAI, launched its first stand-alone consumer app",elon musks artificialintelligence startup xai launched first standalone consumer app,"['elon', 'musks', 'artificialintelligence', 'startup', 'xai', 'launched', 'first', 'standalone', 'consumer', 'app']",3,1,1,0,5,2025-01-09T21:56:02.757Z,wsj.com,The Wall Street Journal,False
"Most people think economic inequality is a big problem for their country, and see the excessive political sway of the rich as the leading cause, according to a report by the Pew Research Center.",people think economic inequality big problem country see excessive political sway rich leading cause according report pew research center,"['people', 'think', 'economic', 'inequality', 'big', 'problem', 'country', 'see', 'excessive', 'political', 'sway', 'rich', 'leading', 'cause', 'according', 'report', 'pew', 'research', 'center']",78,524,88,25,715,2025-01-09T20:48:05.260Z,wsj.com,The Wall Street Journal,False
Breaking: Venezuela's opposition leader was detained by the Maduro regime after emerging from months in hiding,breaking venezuelas opposition leader detained maduro regime emerging months hiding,"['breaking', 'venezuelas', 'opposition', 'leader', 'detained', 'maduro', 'regime', 'emerging', 'months', 'hiding']",1,45,15,3,64,2025-01-09T20:14:56.352Z,wsj.com,The Wall Street Journal,False
"U.S. mortgage rates are back at their highest level since last summer, frustrating homebuyers waiting for a break from some of the steepest borrowing costs in more than a decade",us mortgage rates back highest level since last summer frustrating homebuyers waiting break steepest borrowing costs decade,"['us', 'mortgage', 'rates', 'back', 'highest', 'level', 'since', 'last', 'summer', 'frustrating', 'homebuyers', 'waiting', 'break', 'steepest', 'borrowing', 'costs', 'decade']",5,34,12,3,54,2025-01-09T20:06:09.453Z,wsj.com,The Wall Street Journal,False
"The experiences of Detroit and Laredo, Texas, show how interconnected trade is between the U.S., Canada and Mexico. Tariffs could represent a blow to both cities.",experiences detroit laredo texas show interconnected trade us canada mexico tariffs could represent blow cities,"['experiences', 'detroit', 'laredo', 'texas', 'show', 'interconnected', 'trade', 'us', 'canada', 'mexico', 'tariffs', 'could', 'represent', 'blow', 'cities']",3,21,10,1,35,2025-01-09T19:13:03.253Z,wsj.com,The Wall Street Journal,False
Could 2025 be a better year for job hunting? Signs point to yes.,could better year job hunting signs point yes,"['could', 'better', 'year', 'job', 'hunting', 'signs', 'point', 'yes']",4,6,0,0,10,2025-01-09T18:04:02.658Z,wsj.com,The Wall Street Journal,False
"Vultures, outfitted with tracking devices, are helping researchers and park rangers combat poaching in Uganda.",vultures outfitted tracking devices helping researchers park rangers combat poaching uganda,"['vultures', 'outfitted', 'tracking', 'devices', 'helping', 'researchers', 'park', 'rangers', 'combat', 'poaching', 'uganda']",2,37,9,2,50,2025-01-09T17:00:30.457Z,wsj.com,The Wall Street Journal,False
American Airlines is turning on the charm to win back business fliers.,american airlines turning charm win back business fliers,"['american', 'airlines', 'turning', 'charm', 'win', 'back', 'business', 'fliers']",2,14,3,1,20,2025-01-09T16:25:03.153Z,wsj.com,The Wall Street Journal,False
"When Jason Gay opined that Kansas City was the clear Super Bowl favorite heading into the NFL playoffs, he got an earful from the proud and energized fans of the mighty Detroit Lions. He responds.",jason gay opined kansas city clear super bowl favorite heading nfl playoffs got earful proud energized fans mighty detroit lions responds,"['jason', 'gay', 'opined', 'kansas', 'city', 'clear', 'super', 'bowl', 'favorite', 'heading', 'nfl', 'playoffs', 'got', 'earful', 'proud', 'energized', 'fans', 'mighty', 'detroit', 'lions', 'responds']",0,7,2,1,10,2025-01-09T15:25:02.551Z,wsj.com,The Wall Street Journal,False
The economic toll of the deadly California fires could prove a serious blow to a home-insurance market already mired in crisis.,economic toll deadly california fires could prove serious blow homeinsurance market already mired crisis,"['economic', 'toll', 'deadly', 'california', 'fires', 'could', 'prove', 'serious', 'blow', 'homeinsurance', 'market', 'already', 'mired', 'crisis']",4,16,7,1,28,2025-01-09T14:41:02.756Z,wsj.com,The Wall Street Journal,False
Watch live coverage of the funeral service for Jimmy Carter at the Washington National Cathedral. The former president died Dec. 29 at the age of 100.  🔗 https://on.wsj.com/3WctddT,watch live coverage funeral service jimmy carter washington national cathedral former president died dec age,"['watch', 'live', 'coverage', 'funeral', 'service', 'jimmy', 'carter', 'washington', 'national', 'cathedral', 'former', 'president', 'died', 'dec', 'age']",1,18,5,0,24,2025-01-09T14:05:33.253Z,wsj.com,The Wall Street Journal,True
"Exclusive: Liberty Media, which owns the global motorsport juggernaut Formula One and has a stake in ticketing-and-events company Live Nation, among other holdings, has tapped 56-year-old Derek Chang as its new leader, effective Feb. 1",exclusive liberty media owns global motorsport juggernaut formula one stake ticketingandevents company live nation among holdings tapped yearold derek chang new leader effective feb,"['exclusive', 'liberty', 'media', 'owns', 'global', 'motorsport', 'juggernaut', 'formula', 'one', 'stake', 'ticketingandevents', 'company', 'live', 'nation', 'among', 'holdings', 'tapped', 'yearold', 'derek', 'chang', 'new', 'leader', 'effective', 'feb']",2,18,3,0,23,2025-01-09T00:30:07.148Z,wsj.com,The Wall Street Journal,False
"“Our house was full of smoke, they said, get out, get out now.” The Los Angeles fires, which accelerated at an unforgiving pace overnight, have upended lives, destroyed property and raised the daunting question of just how long it will take the city of stars to control the blaze.",house full smoke said get get los angeles fires accelerated unforgiving pace overnight upended lives destroyed property raised daunting question long take city stars control blaze,"['house', 'full', 'smoke', 'said', 'get', 'get', 'los', 'angeles', 'fires', 'accelerated', 'unforgiving', 'pace', 'overnight', 'upended', 'lives', 'destroyed', 'property', 'raised', 'daunting', 'question', 'long', 'take', 'city', 'stars', 'control', 'blaze']",8,55,14,1,78,2025-01-08T22:53:11.361Z,wsj.com,The Wall Street Journal,False
"Evacuees from the Pacific Palisades neighborhood, long home to some of Los Angeles’ wealthiest residents, expressed worries about whether their homes would survive",evacuees pacific palisades neighborhood long home los angeles wealthiest residents expressed worries whether homes would survive,"['evacuees', 'pacific', 'palisades', 'neighborhood', 'long', 'home', 'los', 'angeles', 'wealthiest', 'residents', 'expressed', 'worries', 'whether', 'homes', 'would', 'survive']",8,15,1,0,24,2025-01-08T22:31:03.349Z,wsj.com,The Wall Street Journal,False
"Santa Ana winds are feared by Californians because they are fast-moving, dry and extremely warm—conditions that can turn a tiny spark into a raging blaze that is difficult for firefighters to control.

A look at how Santa Anas form and why conditions are worse now:",santa ana winds feared californians fastmoving dry extremely warmconditions turn tiny spark raging blaze difficult firefighters control look santa anas form conditions worse,"['santa', 'ana', 'winds', 'feared', 'californians', 'fastmoving', 'dry', 'extremely', 'warmconditions', 'turn', 'tiny', 'spark', 'raging', 'blaze', 'difficult', 'firefighters', 'control', 'look', 'santa', 'anas', 'form', 'conditions', 'worse']",1,30,8,1,40,2025-01-08T21:17:31.453Z,wsj.com,The Wall Street Journal,False
OpenAI CEO Sam Altman is being sued by his sister over allegations he sexually abused her when they were children. He denies the claims.,openai ceo sam altman sued sister allegations sexually abused children denies claims,"['openai', 'ceo', 'sam', 'altman', 'sued', 'sister', 'allegations', 'sexually', 'abused', 'children', 'denies', 'claims']",9,37,14,3,63,2025-01-08T20:25:02.746Z,wsj.com,The Wall Street Journal,False
Exclusive: The leader of the Panama Canal Authority denied Trump’s claims that China is controlling the vital trade route and said Trump’s suggestion that U.S. ships get preferential rates “will lead to chaos”,exclusive leader panama canal authority denied trumps claims china controlling vital trade route said trumps suggestion us ships get preferential rates lead chaos,"['exclusive', 'leader', 'panama', 'canal', 'authority', 'denied', 'trumps', 'claims', 'china', 'controlling', 'vital', 'trade', 'route', 'said', 'trumps', 'suggestion', 'us', 'ships', 'get', 'preferential', 'rates', 'lead', 'chaos']",8,86,21,3,118,2025-01-08T20:09:48.258Z,wsj.com,The Wall Street Journal,False
Fed officials saw risks of higher-than-expected inflation—due in part to potential tariffs by Trump—when they made a “finely balanced” decision last month to lower interest rates,fed officials saw risks higherthanexpected inflationdue part potential tariffs trumpwhen made finely balanced decision last month lower interest rates,"['fed', 'officials', 'saw', 'risks', 'higherthanexpected', 'inflationdue', 'part', 'potential', 'tariffs', 'trumpwhen', 'made', 'finely', 'balanced', 'decision', 'last', 'month', 'lower', 'interest', 'rates']",1,32,14,1,48,2025-01-08T19:40:05.057Z,wsj.com,The Wall Street Journal,False
"A trio of Los Angeles fires are striking one of the most iconic swaths of America. The fires accelerated at an unforgiving pace overnight, upending lives and destroying property.",trio los angeles fires striking one iconic swaths america fires accelerated unforgiving pace overnight upending lives destroying property,"['trio', 'los', 'angeles', 'fires', 'striking', 'one', 'iconic', 'swaths', 'america', 'fires', 'accelerated', 'unforgiving', 'pace', 'overnight', 'upending', 'lives', 'destroying', 'property']",3,15,3,0,21,2025-01-08T18:47:41.047Z,wsj.com,The Wall Street Journal,False
Exclusive: Chinese economist Gao Shanwen questioned Beijing’s ability to boost its economy. Leader Xi Jinping ordered him disciplined.,exclusive chinese economist gao shanwen questioned beijings ability boost economy leader xi jinping ordered disciplined,"['exclusive', 'chinese', 'economist', 'gao', 'shanwen', 'questioned', 'beijings', 'ability', 'boost', 'economy', 'leader', 'xi', 'jinping', 'ordered', 'disciplined']",1,20,9,5,35,2025-01-08T17:00:04.860Z,wsj.com,The Wall Street Journal,False
"Donald Trump outlined a second-term foreign-policy agenda that rests not on global alliances and free trade, but on economic coercion and unilateral military might, even against allies",donald trump outlined secondterm foreignpolicy agenda rests global alliances free trade economic coercion unilateral military might even allies,"['donald', 'trump', 'outlined', 'secondterm', 'foreignpolicy', 'agenda', 'rests', 'global', 'alliances', 'free', 'trade', 'economic', 'coercion', 'unilateral', 'military', 'might', 'even', 'allies']",19,35,16,6,76,2025-01-08T16:25:02.755Z,wsj.com,The Wall Street Journal,False
"Elon Musk, the head of six companies, found time to notch another achievement. He says he recently became one of the world’s top players of ""Diablo IV,"" a videogame set in a fantasy realm that involves making elixirs and slaying demons. https://buff.ly/4a5rwF7",elon musk head six companies found time notch another achievement says recently became one worlds top players diablo iv videogame set fantasy realm involves making elixirs slaying demons,"['elon', 'musk', 'head', 'six', 'companies', 'found', 'time', 'notch', 'another', 'achievement', 'says', 'recently', 'became', 'one', 'worlds', 'top', 'players', 'diablo', 'iv', 'videogame', 'set', 'fantasy', 'realm', 'involves', 'making', 'elixirs', 'slaying', 'demons']",20,29,4,10,63,2025-01-08T15:25:03.456Z,wsj.com,The Wall Street Journal,True
"Hoping to travel more glamorously, save money on trips and pack smartly in 2025? Here are five travel hacks you should think twice about and five to try ahead of your next trip",hoping travel glamorously save money trips pack smartly five travel hacks think twice five try ahead next trip,"['hoping', 'travel', 'glamorously', 'save', 'money', 'trips', 'pack', 'smartly', 'five', 'travel', 'hacks', 'think', 'twice', 'five', 'try', 'ahead', 'next', 'trip']",0,7,1,0,8,2025-01-08T14:41:02.956Z,wsj.com,The Wall Street Journal,False
President-elect Donald Trump filed a last-ditch request asking the Supreme Court to block his coming New York sentencing for covering up hush money paid to an adult-film star,presidentelect donald trump filed lastditch request asking supreme court block coming new york sentencing covering hush money paid adultfilm star,"['presidentelect', 'donald', 'trump', 'filed', 'lastditch', 'request', 'asking', 'supreme', 'court', 'block', 'coming', 'new', 'york', 'sentencing', 'covering', 'hush', 'money', 'paid', 'adultfilm', 'star']",6,19,5,2,32,2025-01-08T13:52:12.357Z,wsj.com,The Wall Street Journal,False
"Review: Rapper and singer Bad Bunny celebrates his homeland on a new album, offering an adventurous survey of Puerto Rico's musical styles",review rapper singer bad bunny celebrates homeland new album offering adventurous survey puerto ricos musical styles,"['review', 'rapper', 'singer', 'bad', 'bunny', 'celebrates', 'homeland', 'new', 'album', 'offering', 'adventurous', 'survey', 'puerto', 'ricos', 'musical', 'styles']",1,42,5,1,49,2025-01-08T02:58:03.156Z,wsj.com,The Wall Street Journal,False
"On Long Island's North Shore, a circa-1770s timber-frame house built by a Revolutionary War soldier is coming on the market for $1.248 million. https://buff.ly/404ZF3g",long islands north shore circas timberframe house built revolutionary war soldier coming market million,"['long', 'islands', 'north', 'shore', 'circas', 'timberframe', 'house', 'built', 'revolutionary', 'war', 'soldier', 'coming', 'market', 'million']",6,87,8,0,101,2025-01-08T01:05:02.959Z,wsj.com,The Wall Street Journal,True
