texto_original,texto_limpo,tokens,comentarios,likes,compartilhamentos,repostagens,total,data_hora,author_handle,author_displayName,image_ref
A former U.S. Marine detained in Australia and accused of training Chinese military pilots will be extradited to the U.S.,former us marine detained australia accused training chinese military pilots extradited us,"['former', 'us', 'marine', 'detained', 'australia', 'accused', 'training', 'chinese', 'military', 'pilots', 'extradited', 'us']",4,43,9,1,57,2024-12-23T17:30:05.756Z,wsj.com,The Wall Street Journal,False
"Matt Gaetz regularly paid women for sex from at least 2017 until 2020, according to an explosive report from the House Ethics Committee",matt gaetz regularly paid women sex least according explosive report house ethics committee,"['matt', 'gaetz', 'regularly', 'paid', 'women', 'sex', 'least', 'according', 'explosive', 'report', 'house', 'ethics', 'committee']",18,50,10,4,82,2024-12-23T16:45:04.068Z,wsj.com,The Wall Street Journal,False
"Luigi Mangione pleaded not guilty Monday to state murder charges in the killing of UnitedHealth executive Brian Thompson, with his lawyer railing that politicians had turned the case into a public spectacle",luigi mangione pleaded guilty monday state murder charges killing unitedhealth executive brian thompson lawyer railing politicians turned case public spectacle,"['luigi', 'mangione', 'pleaded', 'guilty', 'monday', 'state', 'murder', 'charges', 'killing', 'unitedhealth', 'executive', 'brian', 'thompson', 'lawyer', 'railing', 'politicians', 'turned', 'case', 'public', 'spectacle']",4,44,8,4,60,2024-12-23T16:17:55.953Z,wsj.com,The Wall Street Journal,False
"Rarely do Christmas and Hanukkah start on the same day. For people in mixed-faith relationships, Chrismukkah can be a blessing and a curse.",rarely christmas hanukkah start day people mixedfaith relationships chrismukkah blessing curse,"['rarely', 'christmas', 'hanukkah', 'start', 'day', 'people', 'mixedfaith', 'relationships', 'chrismukkah', 'blessing', 'curse']",4,11,3,0,18,2024-12-23T16:00:06.051Z,wsj.com,The Wall Street Journal,False
"President Biden, citing moral and policy objections to capital punishment, said he was commuting the death sentences of 37 inmates. They will serve life imprisonment without parole.",president biden citing moral policy objections capital punishment said commuting death sentences inmates serve life imprisonment without parole,"['president', 'biden', 'citing', 'moral', 'policy', 'objections', 'capital', 'punishment', 'said', 'commuting', 'death', 'sentences', 'inmates', 'serve', 'life', 'imprisonment', 'without', 'parole']",6,53,10,2,71,2024-12-23T15:43:02.853Z,wsj.com,The Wall Street Journal,False
"Where DEI went wrong, according to champions of diversity",dei went wrong according champions diversity,"['dei', 'went', 'wrong', 'according', 'champions', 'diversity']",8,10,2,2,22,2024-12-23T15:25:02.845Z,wsj.com,The Wall Street Journal,False
"A Los Angeles clinic teaches a remarkable skill to people with schizophrenia and other illnesses that trigger psychosis: How to live with imagined voices, hallucinations and false memories.",los angeles clinic teaches remarkable skill people schizophrenia illnesses trigger psychosis live imagined voices hallucinations false memories,"['los', 'angeles', 'clinic', 'teaches', 'remarkable', 'skill', 'people', 'schizophrenia', 'illnesses', 'trigger', 'psychosis', 'live', 'imagined', 'voices', 'hallucinations', 'false', 'memories']",4,31,4,1,40,2024-12-23T15:00:05.249Z,wsj.com,The Wall Street Journal,False
U.S. schools are spending millions on a safety measure to stop bullets and intruders. It does neither. Vendors take advantage of school security officials who have no security background.,us schools spending millions safety measure stop bullets intruders neither vendors take advantage school security officials security background,"['us', 'schools', 'spending', 'millions', 'safety', 'measure', 'stop', 'bullets', 'intruders', 'neither', 'vendors', 'take', 'advantage', 'school', 'security', 'officials', 'security', 'background']",16,157,50,14,237,2024-12-23T14:41:03.145Z,wsj.com,The Wall Street Journal,False
"Emotional breakdowns in private meetings over the election results, clashing over next steps, a fatigued and frustrated base: these are challenging days for Democrats",emotional breakdowns private meetings election results clashing next steps fatigued frustrated base challenging days democrats,"['emotional', 'breakdowns', 'private', 'meetings', 'election', 'results', 'clashing', 'next', 'steps', 'fatigued', 'frustrated', 'base', 'challenging', 'days', 'democrats']",18,15,1,2,36,2024-12-23T14:21:02.154Z,wsj.com,The Wall Street Journal,False
"""I didn’t know what I was walking into."" We asked two real-estate brokers: Has a listing ever landed you in the middle of a family feud?",didnt know walking asked two realestate brokers listing ever landed middle family feud,"['didnt', 'know', 'walking', 'asked', 'two', 'realestate', 'brokers', 'listing', 'ever', 'landed', 'middle', 'family', 'feud']",1,6,0,0,7,2024-12-23T14:00:05.154Z,wsj.com,The Wall Street Journal,False
"Are you an expert at navigating airports? Chances are, you’re actually being subtly guided by design techniques meant to keep crowds moving.",expert navigating airports chances youre actually subtly guided design techniques meant keep crowds moving,"['expert', 'navigating', 'airports', 'chances', 'youre', 'actually', 'subtly', 'guided', 'design', 'techniques', 'meant', 'keep', 'crowds', 'moving']",3,21,4,0,28,2024-12-23T13:41:02.849Z,wsj.com,The Wall Street Journal,False
"Trump is openly discussing provocative aspirations for U.S. territorial expansion, warning about taking over the Panama Canal and wresting control of Greenland from Denmark",trump openly discussing provocative aspirations us territorial expansion warning taking panama canal wresting control greenland denmark,"['trump', 'openly', 'discussing', 'provocative', 'aspirations', 'us', 'territorial', 'expansion', 'warning', 'taking', 'panama', 'canal', 'wresting', 'control', 'greenland', 'denmark']",27,94,36,11,168,2024-12-23T13:20:03.156Z,wsj.com,The Wall Street Journal,False
"A way of smoking pot, called dabbing, has surged in popularity, especially among youths. Health authorities warn it’s dangerous.",way smoking pot called dabbing surged popularity especially among youths health authorities warn dangerous,"['way', 'smoking', 'pot', 'called', 'dabbing', 'surged', 'popularity', 'especially', 'among', 'youths', 'health', 'authorities', 'warn', 'dangerous']",5,14,6,3,28,2024-12-23T13:00:03.157Z,wsj.com,The Wall Street Journal,False
"An analysis recommends that Apple, an emerging target for digital-safety advocates, apply an independent review for software age ratings.",analysis recommends apple emerging target digitalsafety advocates apply independent review software age ratings,"['analysis', 'recommends', 'apple', 'emerging', 'target', 'digitalsafety', 'advocates', 'apply', 'independent', 'review', 'software', 'age', 'ratings']",4,20,7,1,32,2024-12-23T00:00:05.346Z,wsj.com,The Wall Street Journal,False
"Luigi Mangione, charged with murder in the fatal shooting of the UnitedHealthcare CEO, posted online about suffering from back pain, sleeplessness and brain fog.",luigi mangione charged murder fatal shooting unitedhealthcare ceo posted online suffering back pain sleeplessness brain fog,"['luigi', 'mangione', 'charged', 'murder', 'fatal', 'shooting', 'unitedhealthcare', 'ceo', 'posted', 'online', 'suffering', 'back', 'pain', 'sleeplessness', 'brain', 'fog']",13,55,8,4,80,2024-12-22T23:00:03.748Z,wsj.com,The Wall Street Journal,False
"Elon Musk is blowing up plans and taking names as he and the GOP-controlled House start to learn about working with each other, Tim Higgins writes.",elon musk blowing plans taking names gopcontrolled house start learn working tim higgins writes,"['elon', 'musk', 'blowing', 'plans', 'taking', 'names', 'gopcontrolled', 'house', 'start', 'learn', 'working', 'tim', 'higgins', 'writes']",41,47,20,8,116,2024-12-22T22:00:03.947Z,wsj.com,The Wall Street Journal,False
"On podcasts, posts and college campuses, conservatives push their worldview and Donald Trump’s agenda.",podcasts posts college campuses conservatives push worldview donald trumps agenda,"['podcasts', 'posts', 'college', 'campuses', 'conservatives', 'push', 'worldview', 'donald', 'trumps', 'agenda']",26,25,16,4,71,2024-12-22T21:30:03.757Z,wsj.com,The Wall Street Journal,False
Steve Ballmer follows an unconventional investing strategy that has worked out well for him. Read our Q&A with the former Microsoft chief.,steve ballmer follows unconventional investing strategy worked well read qa former microsoft chief,"['steve', 'ballmer', 'follows', 'unconventional', 'investing', 'strategy', 'worked', 'well', 'read', 'qa', 'former', 'microsoft', 'chief']",4,18,2,2,26,2024-12-22T21:00:03.657Z,wsj.com,The Wall Street Journal,False
"Friends and colleagues of Brian Thompson struggle to cope with the UnitedHealth executive’s death, while others cheer for the man accused of killing him.",friends colleagues brian thompson struggle cope unitedhealth executives death others cheer man accused killing,"['friends', 'colleagues', 'brian', 'thompson', 'struggle', 'cope', 'unitedhealth', 'executives', 'death', 'others', 'cheer', 'man', 'accused', 'killing']",37,26,3,3,69,2024-12-22T20:30:02.447Z,wsj.com,The Wall Street Journal,False
"In the “Small Town” that inspired a 1985 hit, residents seeking to integrate migrants are clashing with others calling for them to be rooted out and sent home.",small town inspired hit residents seeking integrate migrants clashing others calling rooted sent home,"['small', 'town', 'inspired', 'hit', 'residents', 'seeking', 'integrate', 'migrants', 'clashing', 'others', 'calling', 'rooted', 'sent', 'home']",21,14,5,1,41,2024-12-22T20:00:04.246Z,wsj.com,The Wall Street Journal,False
Elon Musk’s new influence and Donald Trump’s impulsive style threw the GOP into a familiar form of chaos this past week.,elon musks new influence donald trumps impulsive style threw gop familiar form chaos past week,"['elon', 'musks', 'new', 'influence', 'donald', 'trumps', 'impulsive', 'style', 'threw', 'gop', 'familiar', 'form', 'chaos', 'past', 'week']",4,58,13,3,78,2024-12-22T19:30:03.057Z,wsj.com,The Wall Street Journal,False
Private prisons and other companies are preparing to cash in on what President-elect Donald Trump has billed as “the largest domestic deportation operation in American history.”,private prisons companies preparing cash presidentelect donald trump billed largest domestic deportation operation american history,"['private', 'prisons', 'companies', 'preparing', 'cash', 'presidentelect', 'donald', 'trump', 'billed', 'largest', 'domestic', 'deportation', 'operation', 'american', 'history']",17,54,43,5,119,2024-12-22T19:00:03.351Z,wsj.com,The Wall Street Journal,False
President Biden called the Pentagon four times seeking information about the drones over New Jersey. He was told that the military had found nothing unusual.,president biden called pentagon four times seeking information drones new jersey told military found nothing unusual,"['president', 'biden', 'called', 'pentagon', 'four', 'times', 'seeking', 'information', 'drones', 'new', 'jersey', 'told', 'military', 'found', 'nothing', 'unusual']",8,31,5,3,47,2024-12-22T18:30:02.246Z,wsj.com,The Wall Street Journal,False
OpenAI’s new artificial-intelligence project is behind schedule—and there may not be enough data in the world to make it smart enough.,openais new artificialintelligence project behind scheduleand may enough data world make smart enough,"['openais', 'new', 'artificialintelligence', 'project', 'behind', 'scheduleand', 'may', 'enough', 'data', 'world', 'make', 'smart', 'enough']",6,29,4,1,40,2024-12-22T18:00:03.448Z,wsj.com,The Wall Street Journal,False
Tanzania’s government is evicting tens of thousands of traditional herders from regions where safari resorts and hunting reserves generate substantial revenue.,tanzanias government evicting tens thousands traditional herders regions safari resorts hunting reserves generate substantial revenue,"['tanzanias', 'government', 'evicting', 'tens', 'thousands', 'traditional', 'herders', 'regions', 'safari', 'resorts', 'hunting', 'reserves', 'generate', 'substantial', 'revenue']",4,27,11,3,45,2024-12-22T17:30:02.260Z,wsj.com,The Wall Street Journal,False
"The order was given at 9:03 a.m.—it was the Slovenian spy chief’s one chance to strike. 

Inside the hunt for a secret network of sleeper agents: https://trib.al/frIojro",order given amit slovenian spy chiefs one chance strike inside hunt secret network sleeper agents,"['order', 'given', 'amit', 'slovenian', 'spy', 'chiefs', 'one', 'chance', 'strike', 'inside', 'hunt', 'secret', 'network', 'sleeper', 'agents']",8,46,17,5,76,2024-12-22T16:00:05.654Z,wsj.com,The Wall Street Journal,True
"Exclusive: President Biden is considering commuting the sentences of most, if not all, of the 40 men on the federal government’s death row",exclusive president biden considering commuting sentences men federal governments death row,"['exclusive', 'president', 'biden', 'considering', 'commuting', 'sentences', 'men', 'federal', 'governments', 'death', 'row']",21,365,72,54,512,2024-12-20T23:38:26.060Z,wsj.com,The Wall Street Journal,False
"Breaking: The House passed revised legislation to avert a government shutdown, sending the measure to the Senate hours ahead of a midnight deadline",breaking house passed revised legislation avert government shutdown sending measure senate hours ahead midnight deadline,"['breaking', 'house', 'passed', 'revised', 'legislation', 'avert', 'government', 'shutdown', 'sending', 'measure', 'senate', 'hours', 'ahead', 'midnight', 'deadline']",5,51,20,4,80,2024-12-20T23:11:01.251Z,wsj.com,The Wall Street Journal,False
Eli Lilly said the Food and Drug Administration approved Zepbound for moderate-to-severe obstructive sleep apnea in adults with obesity. It's the first and only prescription medicine for adults suffering from this condition.,eli lilly said food drug administration approved zepbound moderatetosevere obstructive sleep apnea adults obesity first prescription medicine adults suffering condition,"['eli', 'lilly', 'said', 'food', 'drug', 'administration', 'approved', 'zepbound', 'moderatetosevere', 'obstructive', 'sleep', 'apnea', 'adults', 'obesity', 'first', 'prescription', 'medicine', 'adults', 'suffering', 'condition']",2,45,9,4,60,2024-12-20T22:59:06.450Z,wsj.com,The Wall Street Journal,False
"Crypto news website CoinDesk dismissed its top three editors Friday, after the publication of a since-deleted story prompted backlash from a crypto titan",crypto news website coindesk dismissed top three editors friday publication sincedeleted story prompted backlash crypto titan,"['crypto', 'news', 'website', 'coindesk', 'dismissed', 'top', 'three', 'editors', 'friday', 'publication', 'sincedeleted', 'story', 'prompted', 'backlash', 'crypto', 'titan']",6,30,17,5,58,2024-12-20T22:55:25.654Z,wsj.com,The Wall Street Journal,False
"Review: ""ChiefsAholic: A Wolf in Chiefs Clothing,"" a documentary, revisits the case of Xaviar Babudar, a Kansas City football obsessive who was well known at games and online—and had another, decidedly more criminal pastime",review chiefsaholic wolf chiefs clothing documentary revisits case xaviar babudar kansas city football obsessive well known games onlineand another decidedly criminal pastime,"['review', 'chiefsaholic', 'wolf', 'chiefs', 'clothing', 'documentary', 'revisits', 'case', 'xaviar', 'babudar', 'kansas', 'city', 'football', 'obsessive', 'well', 'known', 'games', 'onlineand', 'another', 'decidedly', 'criminal', 'pastime']",2,21,1,2,26,2024-12-20T22:47:45.857Z,wsj.com,The Wall Street Journal,False
We can put tons of metal in the sky. Why is finding something to help us sleep on a plane still so hard?,put tons metal sky finding something help us sleep plane still hard,"['put', 'tons', 'metal', 'sky', 'finding', 'something', 'help', 'us', 'sleep', 'plane', 'still', 'hard']",12,26,3,2,43,2024-12-20T21:56:02.553Z,wsj.com,The Wall Street Journal,False
"Heard on the Street: America is No. 1…in infuriating health insurance. How it got that way, and what could make it less maddening.",heard street america infuriating health insurance got way could make less maddening,"['heard', 'street', 'america', 'infuriating', 'health', 'insurance', 'got', 'way', 'could', 'make', 'less', 'maddening']",11,36,7,0,54,2024-12-20T20:25:02.253Z,wsj.com,The Wall Street Journal,False
Eight people were convicted of helping the man who beheaded French schoolteacher Samuel Paty four years ago after he showed caricatures of Islam’s Prophet Muhammad in class as part of a lesson on free speech,eight people convicted helping man beheaded french schoolteacher samuel paty four years ago showed caricatures islams prophet muhammad class part lesson free speech,"['eight', 'people', 'convicted', 'helping', 'man', 'beheaded', 'french', 'schoolteacher', 'samuel', 'paty', 'four', 'years', 'ago', 'showed', 'caricatures', 'islams', 'prophet', 'muhammad', 'class', 'part', 'lesson', 'free', 'speech']",2,46,10,1,59,2024-12-20T20:24:50.481Z,wsj.com,The Wall Street Journal,False
"A car rammed a German Christmas market in Magdeburg, in eastern Germany, leaving several people wounded",car rammed german christmas market magdeburg eastern germany leaving several people wounded,"['car', 'rammed', 'german', 'christmas', 'market', 'magdeburg', 'eastern', 'germany', 'leaving', 'several', 'people', 'wounded']",7,22,5,2,36,2024-12-20T20:14:44.355Z,wsj.com,The Wall Street Journal,False
"Some companies no longer deliver bad news face to face, or even over a Zoom call. A pink slip can come via a text message and email.",companies longer deliver bad news face face even zoom call pink slip come via text message email,"['companies', 'longer', 'deliver', 'bad', 'news', 'face', 'face', 'even', 'zoom', 'call', 'pink', 'slip', 'come', 'via', 'text', 'message', 'email']",2,9,1,1,13,2024-12-20T19:13:02.660Z,wsj.com,The Wall Street Journal,False
A new type of addict is showing up at Gamblers Anonymous meetings across the country: investors hooked on the market’s riskiest trades,new type addict showing gamblers anonymous meetings across country investors hooked markets riskiest trades,"['new', 'type', 'addict', 'showing', 'gamblers', 'anonymous', 'meetings', 'across', 'country', 'investors', 'hooked', 'markets', 'riskiest', 'trades']",6,29,11,3,49,2024-12-20T18:04:02.761Z,wsj.com,The Wall Street Journal,False
"From an island bouncing back from a natural disaster with aplomb to a popular city ringing in a major birthday, these are the 10 destinations that should be on your to-go list for 2025.",island bouncing back natural disaster aplomb popular city ringing major birthday destinations togo list,"['island', 'bouncing', 'back', 'natural', 'disaster', 'aplomb', 'popular', 'city', 'ringing', 'major', 'birthday', 'destinations', 'togo', 'list']",0,15,3,1,19,2024-12-20T17:00:04.557Z,wsj.com,The Wall Street Journal,False
Shaken and stirred: James Bond is stuck in a tug-of-war between the family that controls 007 and his new overlords at Amazon,shaken stirred james bond stuck tugofwar family controls new overlords amazon,"['shaken', 'stirred', 'james', 'bond', 'stuck', 'tugofwar', 'family', 'controls', 'new', 'overlords', 'amazon']",3,17,5,4,29,2024-12-20T16:25:02.156Z,wsj.com,The Wall Street Journal,False
"Drone hysteria is gripping the Garden State. While locals float theories and search for clues, the wider world wants to know: Of all places, why New Jersey?",drone hysteria gripping garden state locals float theories search clues wider world wants know places new jersey,"['drone', 'hysteria', 'gripping', 'garden', 'state', 'locals', 'float', 'theories', 'search', 'clues', 'wider', 'world', 'wants', 'know', 'places', 'new', 'jersey']",11,18,3,2,34,2024-12-20T15:25:02.250Z,wsj.com,The Wall Street Journal,False
"The messy government-spending bill explained: Donald Trump, Elon Musk, Democrats, an NFL stadium and several other forces have collided to create a Washington “Christmas tree” of chaos",messy governmentspending bill explained donald trump elon musk democrats nfl stadium several forces collided create washington christmas tree chaos,"['messy', 'governmentspending', 'bill', 'explained', 'donald', 'trump', 'elon', 'musk', 'democrats', 'nfl', 'stadium', 'several', 'forces', 'collided', 'create', 'washington', 'christmas', 'tree', 'chaos']",11,23,3,3,40,2024-12-20T14:41:02.652Z,wsj.com,The Wall Street Journal,False
Blackstone and Apollo Global Management have released their highly produced rival annual holiday videos.,blackstone apollo global management released highly produced rival annual holiday videos,"['blackstone', 'apollo', 'global', 'management', 'released', 'highly', 'produced', 'rival', 'annual', 'holiday', 'videos']",4,18,2,0,24,2024-12-19T23:57:03.160Z,wsj.com,The Wall Street Journal,False
"Doctors The Journal podcast spoke with made it clear they disavow the shooting of the UnitedHealthcare CEO. Still, they had two main complaints.

🎧 Listen: Two doctors explain how dealing with health insurers is getting worse.",doctors journal podcast spoke made clear disavow shooting unitedhealthcare ceo still two main complaints listen two doctors explain dealing health insurers getting worse,"['doctors', 'journal', 'podcast', 'spoke', 'made', 'clear', 'disavow', 'shooting', 'unitedhealthcare', 'ceo', 'still', 'two', 'main', 'complaints', 'listen', 'two', 'doctors', 'explain', 'dealing', 'health', 'insurers', 'getting', 'worse']",5,41,6,2,54,2024-12-19T23:28:02.347Z,wsj.com,The Wall Street Journal,False
"The Walton family is passing some of its control in Walmart to the next generation, giving all the grandchildren of Walmart’s founder voting rights over their inheritance",walton family passing control walmart next generation giving grandchildren walmarts founder voting rights inheritance,"['walton', 'family', 'passing', 'control', 'walmart', 'next', 'generation', 'giving', 'grandchildren', 'walmarts', 'founder', 'voting', 'rights', 'inheritance']",8,22,7,1,38,2024-12-19T22:55:03.150Z,wsj.com,The Wall Street Journal,False
Andrew Cuomo filed a court document indicating he plans to sue one of the women who accused him of sexual harassment while he was governor of New York.,andrew cuomo filed court document indicating plans sue one women accused sexual harassment governor new york,"['andrew', 'cuomo', 'filed', 'court', 'document', 'indicating', 'plans', 'sue', 'one', 'women', 'accused', 'sexual', 'harassment', 'governor', 'new', 'york']",13,28,9,2,52,2024-12-19T22:32:02.462Z,wsj.com,The Wall Street Journal,False
The RealReal’s sales have grown for three straight quarters as shoppers look to the secondhand market to save on high-end wares. https://trib.al/s0NM47t,realreals sales grown three straight quarters shoppers look secondhand market save highend wares,"['realreals', 'sales', 'grown', 'three', 'straight', 'quarters', 'shoppers', 'look', 'secondhand', 'market', 'save', 'highend', 'wares']",0,17,3,0,20,2024-12-19T21:56:02.654Z,wsj.com,The Wall Street Journal,True
"The clock is ticking down to a Friday-night deadline until federal agencies run out of money. A government shutdown would restrict a range of government operations, although critical services would continue. Here’s what to expect.",clock ticking fridaynight deadline federal agencies run money government shutdown would restrict range government operations although critical services would continue heres expect,"['clock', 'ticking', 'fridaynight', 'deadline', 'federal', 'agencies', 'run', 'money', 'government', 'shutdown', 'would', 'restrict', 'range', 'government', 'operations', 'although', 'critical', 'services', 'would', 'continue', 'heres', 'expect']",17,80,27,5,129,2024-12-19T20:19:43.149Z,wsj.com,The Wall Street Journal,False
"Review: Adrien Brody and Guy Pearce star in ""The Brutalist,"" director Brady Corbet’s epic drama about a Hungarian Jewish architect and the wealthy American who enlists him for a monumental project",review adrien brody guy pearce star brutalist director brady corbets epic drama hungarian jewish architect wealthy american enlists monumental project,"['review', 'adrien', 'brody', 'guy', 'pearce', 'star', 'brutalist', 'director', 'brady', 'corbets', 'epic', 'drama', 'hungarian', 'jewish', 'architect', 'wealthy', 'american', 'enlists', 'monumental', 'project']",2,19,1,0,22,2024-12-19T20:06:23.151Z,wsj.com,The Wall Street Journal,False
"Some of the nation’s most secure federal buildings house a network of gift shops most people will never see. 

It isn’t impossible to visit, but it is difficult: You either need to be a CIA employee or know one. 

🔗: trib.al/hAgf079",nations secure federal buildings house network gift shops people never see isnt impossible visit difficult either need cia employee know one tribalhagf,"['nations', 'secure', 'federal', 'buildings', 'house', 'network', 'gift', 'shops', 'people', 'never', 'see', 'isnt', 'impossible', 'visit', 'difficult', 'either', 'need', 'cia', 'employee', 'know', 'one', 'tribalhagf']",2,16,2,0,20,2024-12-19T19:56:44.055Z,wsj.com,The Wall Street Journal,True
